"BROKEN","EPIC","FAILED","FEATURE","PASSED","SKIPPED","STORY","UNKNOWN"
"0","EP-01 Authentication & Session","2","app-under-test/e2e/auth.spec.js","0","0","Auth modal: Forgot password","0"
"0","EP-08 Accessibility Compliance (WCAG 2.1 AA)","7","app-under-test/e2e/accessibility.spec.js","0","0","Accessibility: Layout structure","0"
"0","EP-09 API Health & Contract Smoke","7","app-under-test/api/smoke.spec.js","0","0","Edge function smoke tests","0"
"0","EP-01 Authentication & Session","5","app-under-test/e2e/auth.spec.js","0","0","Auth modal: Sign In","0"
"0","EP-02 Marketing Funnel & Acquisition","6","app-under-test/e2e/landing.spec.js","0","0","Landing page","0"
"0","EP-01 Authentication & Session","5","app-under-test/e2e/auth.spec.js","0","0","Auth modal: Sign Up","0"
"0","EP-08 Accessibility Compliance (WCAG 2.1 AA)","3","app-under-test/e2e/accessibility.spec.js","0","0","Accessibility: Keyboard interaction","0"
"0","EP-08 Accessibility Compliance (WCAG 2.1 AA)","3","app-under-test/e2e/accessibility.spec.js","0","0","Accessibility: WCAG + best practice","0"
"0","EP-08 Accessibility Compliance (WCAG 2.1 AA)","1","app-under-test/e2e/accessibility.spec.js","0","0","Accessibility: Form labels","0"
