"DESCRIPTION","DURATION IN MS","NAME","PARENT SUITE","START TIME","STATUS","STOP TIME","SUB SUITE","SUITE","TEST CLASS","TEST METHOD"
"","845","sidebar is visible after login","EP-04 Dashboard & Navigation","2026-06-01","passed","2026-06-01","","app-under-test/e2e/dashboard.spec.js","",""
"","802","page title is set","EP-04 Dashboard & Navigation","2026-06-01","passed","2026-06-01","","app-under-test/e2e/dashboard.spec.js","",""
"","1640","page loads with a non-empty title","EP-10 Miscellaneous","2026-06-01","passed","2026-06-01","","Landing","",""
"","372","page does not show a 404 or error","EP-10 Miscellaneous","2026-06-01","passed","2026-06-01","","Fireq2","",""
"","1284","Open the new invoice form","EP-10 Miscellaneous","2026-06-01","passed","2026-06-01","","../.features-gen/apps/app-under-test/features/invoice-lifecycle.feature.spec.js","",""
"","11409","Sign In tab switches back to login mode","EP-01 Authentication & Session","2026-06-01","passed","2026-06-01","","app-under-test/e2e/auth.spec.js","",""
"","0","form popup appears when CTA is clicked","EP-10 Miscellaneous","2026-06-01","skipped","2026-06-01","","Forms","",""
"","10980","shows reset form with Send Reset Link button","EP-01 Authentication & Session","2026-06-01","passed","2026-06-01","","app-under-test/e2e/auth.spec.js","",""
"","10977","page title is set and non-empty","EP-08 Accessibility Compliance (WCAG 2.1 AA)","2026-06-01","passed","2026-06-01","","app-under-test/e2e/accessibility.spec.js","",""
"","16119","landing page has no violations","EP-08 Accessibility Compliance (WCAG 2.1 AA)","2026-06-01","passed","2026-06-01","","app-under-test/e2e/accessibility.spec.js","",""
"","3449","invoice list loads","EP-04 Dashboard & Navigation","2026-06-01","passed","2026-06-01","","app-under-test/e2e/dashboard.spec.js","",""
"","1194","clicking profile button opens modal","EP-07 Account Settings & Profile","2026-06-01","passed","2026-06-01","","app-under-test/e2e/profile.spec.js","",""
"","7522","Sign Up tab switches to signup mode","EP-01 Authentication & Session","2026-06-01","passed","2026-06-01","","app-under-test/e2e/auth.spec.js","",""
"","330","header is visible","EP-10 Miscellaneous","2026-06-01","passed","2026-06-01","","Landing","",""
"","6995","page has a main landmark","EP-08 Accessibility Compliance (WCAG 2.1 AA)","2026-06-01","passed","2026-06-01","","app-under-test/e2e/accessibility.spec.js","",""
"","1167","clicking billing opens modal","EP-06 Subscription Billing & Payments","2026-06-01","passed","2026-06-01","","app-under-test/e2e/billing.spec.js","",""
"","297","CTA buttons have a real href or trigger an action","EP-10 Miscellaneous","2026-06-01","passed","2026-06-01","","Sneaky","",""
"","1143","can open new invoice form","EP-05 Record Lifecycle (CRUD)","2026-06-01","passed","2026-06-01","","app-under-test/e2e/invoices.spec.js","",""
"","11515","Forgot password link appears in login mode","EP-01 Authentication & Session","2026-06-01","passed","2026-06-01","","app-under-test/e2e/auth.spec.js","",""
"","1231","new invoice form has client name field","EP-05 Record Lifecycle (CRUD)","2026-06-01","passed","2026-06-01","","app-under-test/e2e/invoices.spec.js","",""
"","621","checkout is alive and requires auth","EP-09 API Health & Contract Smoke","2026-06-01","passed","2026-06-01","","app-under-test/api/smoke.spec.js","",""
"","405","profile is alive and requires auth","EP-09 API Health & Contract Smoke","2026-06-01","passed","2026-06-01","","app-under-test/api/smoke.spec.js","",""
"","1023","trash button opens recently deleted modal","EP-06 Subscription Billing & Payments","2026-06-01","passed","2026-06-01","","app-under-test/e2e/billing.spec.js","",""
"","1406","cancel closes the invoice form","EP-05 Record Lifecycle (CRUD)","2026-06-01","passed","2026-06-01","","app-under-test/e2e/invoices.spec.js","",""
"","1074","billing link is visible in sidebar","EP-06 Subscription Billing & Payments","2026-06-01","passed","2026-06-01","","app-under-test/e2e/billing.spec.js","",""
"","230","phone or email contact info is present and linked","EP-10 Miscellaneous","2026-06-01","passed","2026-06-01","","Sneaky","",""
"","10671","auth modal receives focus on open","EP-08 Accessibility Compliance (WCAG 2.1 AA)","2026-06-01","passed","2026-06-01","","app-under-test/e2e/accessibility.spec.js","",""
"","0","empty form submit shows a validation error","EP-10 Miscellaneous","2026-06-01","skipped","2026-06-01","","Forms","",""
"","14754","sign in modal has no violations","EP-08 Accessibility Compliance (WCAG 2.1 AA)","2026-06-01","passed","2026-06-01","","app-under-test/e2e/accessibility.spec.js","",""
"","12104","submitting with a weak password shows an error","EP-01 Authentication & Session","2026-06-01","passed","2026-06-01","","app-under-test/e2e/auth.spec.js","",""
"","309","page does not show a 404 or error","EP-10 Miscellaneous","2026-06-01","passed","2026-06-01","","Landing","",""
"","228","header is visible","EP-10 Miscellaneous","2026-06-01","passed","2026-06-01","","Fireq2","",""
"","6334","Escape closes the sign up modal","EP-08 Accessibility Compliance (WCAG 2.1 AA)","2026-06-01","passed","2026-06-01","","app-under-test/e2e/accessibility.spec.js","",""
"","1072","profile modal closes on Escape","EP-07 Account Settings & Profile","2026-06-01","passed","2026-06-01","","app-under-test/e2e/profile.spec.js","",""
"","7003","shows email field","EP-01 Authentication & Session","2026-06-01","passed","2026-06-01","","app-under-test/e2e/auth.spec.js","",""
"","9042","Sign Up nav button is visible","EP-02 Marketing Funnel & Acquisition","2026-06-01","passed","2026-06-01","","app-under-test/e2e/landing.spec.js","",""
"","342","subscription status is alive and requires auth","EP-09 API Health & Contract Smoke","2026-06-01","passed","2026-06-01","","app-under-test/api/smoke.spec.js","",""
"","814","send is alive and requires auth","EP-09 API Health & Contract Smoke","2026-06-01","passed","2026-06-01","","app-under-test/api/smoke.spec.js","",""
"","800","records function is alive and requires auth","EP-09 API Health & Contract Smoke","2026-06-01","passed","2026-06-01","","app-under-test/api/smoke.spec.js","",""
"","979","profile button is visible in sidebar","EP-07 Account Settings & Profile","2026-06-01","passed","2026-06-01","","app-under-test/e2e/profile.spec.js","",""
"","11390","shows password field","EP-01 Authentication & Session","2026-06-01","passed","2026-06-01","","app-under-test/e2e/auth.spec.js","",""
"","879","new invoice button is visible","EP-04 Dashboard & Navigation","2026-06-01","passed","2026-06-01","","app-under-test/e2e/dashboard.spec.js","",""
"","1202","at least one button or CTA link is visible on homepage","EP-10 Miscellaneous","2026-06-01","passed","2026-06-01","","Forms","",""
"","12019","mismatched passwords shows an error","EP-01 Authentication & Session","2026-06-01","passed","2026-06-01","","app-under-test/e2e/auth.spec.js","",""
"","1289","billing modal shows current plan","EP-06 Subscription Billing & Payments","2026-06-01","passed","2026-06-01","","app-under-test/e2e/billing.spec.js","",""
"","1090","profile modal has email field","EP-07 Account Settings & Profile","2026-06-01","passed","2026-06-01","","app-under-test/e2e/profile.spec.js","",""
"","1143","clicking new invoice opens the form","EP-04 Dashboard & Navigation","2026-06-01","passed","2026-06-01","","app-under-test/e2e/dashboard.spec.js","",""
"","503","no nav links point to bare #","EP-10 Miscellaneous","2026-06-01","passed","2026-06-01","","Sneaky","",""
"","1149","no JavaScript errors from site code on homepage","EP-10 Miscellaneous","2026-06-01","passed","2026-06-01","","Sneaky","",""
"","1118","profile modal has business name field","EP-07 Account Settings & Profile","2026-06-01","passed","2026-06-01","","app-under-test/e2e/profile.spec.js","",""
"","799","page loads with a non-empty title","EP-10 Miscellaneous","2026-06-01","passed","2026-06-01","","Fireq2","",""
"","812","page title is not generic WordPress default","EP-10 Miscellaneous","2026-06-01","passed","2026-06-01","","Sneaky","",""
"","10653","shows Continue with Google button","EP-01 Authentication & Session","2026-06-01","passed","2026-06-01","","app-under-test/e2e/auth.spec.js","",""
"","12064","Back to sign in link returns to login mode","EP-01 Authentication & Session","2026-06-01","passed","2026-06-01","","app-under-test/e2e/auth.spec.js","",""
"","8274","footer has Privacy link","EP-02 Marketing Funnel & Acquisition","2026-06-01","passed","2026-06-01","","app-under-test/e2e/landing.spec.js","",""
"","1260","new invoice form has a line item description field","EP-05 Record Lifecycle (CRUD)","2026-06-01","passed","2026-06-01","","app-under-test/e2e/invoices.spec.js","",""
"","238","no broken images on homepage","EP-10 Miscellaneous","2026-06-01","passed","2026-06-01","","Sneaky","",""
"","12144","page has a navigation landmark","EP-08 Accessibility Compliance (WCAG 2.1 AA)","2026-06-01","passed","2026-06-01","","app-under-test/e2e/accessibility.spec.js","",""
"","11254","opens auth modal with Welcome back heading","EP-01 Authentication & Session","2026-06-01","passed","2026-06-01","","app-under-test/e2e/auth.spec.js","",""
"","12352","all images have non-empty alt text","EP-08 Accessibility Compliance (WCAG 2.1 AA)","2026-06-01","passed","2026-06-01","","app-under-test/e2e/accessibility.spec.js","",""
"","9441","heading hierarchy has no skipped levels","EP-08 Accessibility Compliance (WCAG 2.1 AA)","2026-06-01","passed","2026-06-01","","app-under-test/e2e/accessibility.spec.js","",""
"","233","footer is present","EP-10 Miscellaneous","2026-06-01","passed","2026-06-01","","Landing","",""
"","799","text parse is alive and requires auth","EP-09 API Health & Contract Smoke","2026-06-01","passed","2026-06-01","","app-under-test/api/smoke.spec.js","",""
"","12031","sign in form inputs all have labels","EP-08 Accessibility Compliance (WCAG 2.1 AA)","2026-06-01","passed","2026-06-01","","app-under-test/e2e/accessibility.spec.js","",""
"","11682","page has exactly one h1","EP-08 Accessibility Compliance (WCAG 2.1 AA)","2026-06-01","passed","2026-06-01","","app-under-test/e2e/accessibility.spec.js","",""
"","9944","a hero CTA button is visible","EP-02 Marketing Funnel & Acquisition","2026-06-01","passed","2026-06-01","","app-under-test/e2e/landing.spec.js","",""
"","820","voice parse is alive and requires auth","EP-09 API Health & Contract Smoke","2026-06-01","passed","2026-06-01","","app-under-test/api/smoke.spec.js","",""
"","11136","page has a non empty title","EP-02 Marketing Funnel & Acquisition","2026-06-01","passed","2026-06-01","","app-under-test/e2e/landing.spec.js","",""
"","6877","opens auth modal with Create your account heading","EP-01 Authentication & Session","2026-06-01","passed","2026-06-01","","app-under-test/e2e/auth.spec.js","",""
"","10757","Escape closes the sign in modal","EP-08 Accessibility Compliance (WCAG 2.1 AA)","2026-06-01","passed","2026-06-01","","app-under-test/e2e/accessibility.spec.js","",""
"","11137","all buttons have an accessible name","EP-08 Accessibility Compliance (WCAG 2.1 AA)","2026-06-01","passed","2026-06-01","","app-under-test/e2e/accessibility.spec.js","",""
"","1371","Fill in client and line item","EP-10 Miscellaneous","2026-06-01","passed","2026-06-01","","../.features-gen/apps/app-under-test/features/invoice-lifecycle.feature.spec.js","",""
"","5796","Sign In nav button is visible","EP-02 Marketing Funnel & Acquisition","2026-06-01","passed","2026-06-01","","app-under-test/e2e/landing.spec.js","",""
"","253","navigation menu has links","EP-10 Miscellaneous","2026-06-01","passed","2026-06-01","","Landing","",""
"","227","main content area is visible","EP-10 Miscellaneous","2026-06-01","passed","2026-06-01","","Fireq2","",""
"","1146","Cancel discards the new invoice form","EP-10 Miscellaneous","2026-06-01","passed","2026-06-01","","../.features-gen/apps/app-under-test/features/invoice-lifecycle.feature.spec.js","",""
"","924","invoice list shows status filters","EP-05 Record Lifecycle (CRUD)","2026-06-01","passed","2026-06-01","","app-under-test/e2e/invoices.spec.js","",""
"","8531","footer has Terms link","EP-02 Marketing Funnel & Acquisition","2026-06-01","passed","2026-06-01","","app-under-test/e2e/landing.spec.js","",""
"","851","sidebar shows invoices nav link","EP-04 Dashboard & Navigation","2026-06-01","passed","2026-06-01","","app-under-test/e2e/dashboard.spec.js","",""
"","1216","billing modal closes on Escape","EP-06 Subscription Billing & Payments","2026-06-01","passed","2026-06-01","","app-under-test/e2e/billing.spec.js","",""
"","15273","sign up modal has no violations","EP-08 Accessibility Compliance (WCAG 2.1 AA)","2026-06-01","passed","2026-06-01","","app-under-test/e2e/accessibility.spec.js","",""
"","311","HTTP redirects to HTTPS","EP-10 Miscellaneous","2026-06-01","passed","2026-06-01","","Sneaky","",""
